<?xml version="1.0" encoding="UTF-8"?>
<!--Sample XML file generated by XMLSpy v2011 sp1 (x64) (http://www.altova.com)-->
<ns1:creditRequest xsi:schemaLocation="http://itq.edu/soa/credit credit.xsd" xmlns:ns1="http://itq.edu/soa/credit" xmlns:xsi="http://www.w3.org/2001/XMLSchema-instance">
	<ns1:nombres>Luis Gerardo</ns1:nombres>
	<ns1:apellidoPaterno>Gomez</ns1:apellidoPaterno>
	<ns1:apellidoMaterno>Chavez</ns1:apellidoMaterno>
	<ns1:curp>VEGA780615HDFLML08</ns1:curp>
	<ns1:domicilio>vista bonita #109 col. villa del sol</ns1:domicilio>
	<ns1:correo>alessandromx@outlook.com</ns1:correo>
	<ns1:salario>15000</ns1:salario>
	<ns1:monto>760000</ns1:monto>
	<ns1:tasaInteres>.11</ns1:tasaInteres>
	<ns1:plazo>180</ns1:plazo>
</ns1:creditRequest>
